{"assignment":{"frozen_question_text":"PLANNING PLACEHOLDER ONLY","human_gold_at_assignment":false,"machine_labels_are_provisional":true,"source_content_hashes":[],"source_duration_s":2100,"source_reference":"FUTURE_SOURCE_NOT_COLLECTED"},"assignment_hash":"sha256:15db19b79ce952b7ddfbe95bb8ce42cbe8be5c5a31be4bfb1bcb577e0b8b1860","assignment_tier":"BLINDED_POST_ADJUDICATION","completion_status":"not_started","family_id":"future.v.museum.tour","form_id":"cv-packet-cv-sample-4a09a83f294e.future.v.museum.tour.blind_post_adjudication_saturation_auditor","packet_id":"cv-packet-cv-sample-4a09a83f294e","post_adjudication":{"adjudication_form_id":"cv-packet-cv-sample-4a09a83f294e.future.v.museum.tour.adjudicator","adjudication_was_frozen_before_start":null,"frozen_adjudication_sha256":null},"record_type":"construct_validation_saturation_audit","review":{},"reviewer":{"active_minutes":null,"blinded_to":["accepted_ses_ledger","preferred_ses","machine_ranks","machine_confidence","machine_tier_evidence","validator_decisions","adjudication_decisions"],"completed_at":null,"declared_role":"blind_post_adjudication_saturation_auditor","independent_of_all_prior_reviewers":null,"reviewer_id":null,"started_at":null},"role":"blind_post_adjudication_saturation_auditor","schema_version":"1.0.0","source_id":"future-source-008"}
