{"assignment":{"frozen_question_text":"How many hurricane-formation factors are stated in the narration and introduced by the graphic?","human_gold_at_assignment":false,"machine_labels_are_provisional":true,"source_content_hashes":["sha256:c4f5d8c6e60d6802bb60e26f811f5dcabc9698626a29c6cb8aabcc373db4eef1"],"source_duration_s":2693.503,"source_reference":"data/restricted/noaa01/raw/08_climatealive_archive_1001_smc.mp4"},"assignment_hash":"sha256:0d99f5b4482b5a6e371e35ca73a5391fb960ff6d916825fb73acb499a90e5f42","assignment_tier":"BLINDED_POST_ADJUDICATION","completion_status":"not_started","family_id":"current.noaa01-r016-three-factors-vs","form_id":"cv-packet-cv-sample-4a09a83f294e.current.noaa01-r016-three-factors-vs.blind_post_adjudication_saturation_auditor","packet_id":"cv-packet-cv-sample-4a09a83f294e","post_adjudication":{"adjudication_form_id":"cv-packet-cv-sample-4a09a83f294e.current.noaa01-r016-three-factors-vs.adjudicator","adjudication_was_frozen_before_start":null,"frozen_adjudication_sha256":null},"record_type":"construct_validation_saturation_audit","review":{},"reviewer":{"active_minutes":null,"blinded_to":["accepted_ses_ledger","preferred_ses","machine_ranks","machine_confidence","machine_tier_evidence","validator_decisions","adjudication_decisions"],"completed_at":null,"declared_role":"blind_post_adjudication_saturation_auditor","independent_of_all_prior_reviewers":null,"reviewer_id":null,"started_at":null},"role":"blind_post_adjudication_saturation_auditor","schema_version":"1.0.0","source_id":"cand-052"}
