{"assignment":{"frozen_question_text":"What water conditions are visible around the person, and which environmental sounds occur in the same interval?","human_gold_at_assignment":false,"machine_labels_are_provisional":true,"source_content_hashes":["sha256:1934c31cb0311a46daab367f840eb549d29bb1e9e1475a73287912bba03069e5"],"source_duration_s":2465.329542,"source_reference":"data/restricted/noaa01/raw/05_archive_070620_sm.mp4"},"assignment_hash":"sha256:35b2ae73b266508e317f34af164ebbd461bc14a2d2976525be18a0d8caa8c716","assignment_tier":"BLINDED_POST_ADJUDICATION","completion_status":"not_started","family_id":"current.noaa01-r004-surf-av","form_id":"cv-packet-cv-sample-4a09a83f294e.current.noaa01-r004-surf-av.blind_post_adjudication_saturation_auditor","packet_id":"cv-packet-cv-sample-4a09a83f294e","post_adjudication":{"adjudication_form_id":"cv-packet-cv-sample-4a09a83f294e.current.noaa01-r004-surf-av.adjudicator","adjudication_was_frozen_before_start":null,"frozen_adjudication_sha256":null},"record_type":"construct_validation_saturation_audit","review":{},"reviewer":{"active_minutes":null,"blinded_to":["accepted_ses_ledger","preferred_ses","machine_ranks","machine_confidence","machine_tier_evidence","validator_decisions","adjudication_decisions"],"completed_at":null,"declared_role":"blind_post_adjudication_saturation_auditor","independent_of_all_prior_reviewers":null,"reviewer_id":null,"started_at":null},"role":"blind_post_adjudication_saturation_auditor","schema_version":"1.0.0","source_id":"cand-049"}
