{"assignment":{"frozen_question_text":"PLANNING PLACEHOLDER ONLY","human_gold_at_assignment":false,"machine_labels_are_provisional":true,"source_content_hashes":[],"source_duration_s":2400,"source_reference":"FUTURE_SOURCE_NOT_COLLECTED"},"assignment_hash":"sha256:76e79bd8cb026364185203d4e8e5d332c48514ed21b98676a49cadf0c5e5b8bf","assignment_tier":"BLINDED_POST_ADJUDICATION","completion_status":"not_started","family_id":"future.vsa.field.demonstration.second","form_id":"cv-packet-cv-sample-4a09a83f294e.future.vsa.field.demonstration.second.blind_post_adjudication_saturation_auditor","packet_id":"cv-packet-cv-sample-4a09a83f294e","post_adjudication":{"adjudication_form_id":"cv-packet-cv-sample-4a09a83f294e.future.vsa.field.demonstration.second.adjudicator","adjudication_was_frozen_before_start":null,"frozen_adjudication_sha256":null},"record_type":"construct_validation_saturation_audit","review":{},"reviewer":{"active_minutes":null,"blinded_to":["accepted_ses_ledger","preferred_ses","machine_ranks","machine_confidence","machine_tier_evidence","validator_decisions","adjudication_decisions"],"completed_at":null,"declared_role":"blind_post_adjudication_saturation_auditor","independent_of_all_prior_reviewers":null,"reviewer_id":null,"started_at":null},"role":"blind_post_adjudication_saturation_auditor","schema_version":"1.0.0","source_id":"future-source-005"}
